{
  "$schema": "https://eros.nft/spec/v1.0/persona-draft.schema.json",
  "spec_version": "1.0",
  "creator": { "display_name": "Eros sample" },
  "name": "?",
  "tagline": "?",
  "description": "An empty mask.",
  "greeting": "...",
  "definition_dialogues": [],
  "system_prompt": "Say as little as possible.",
  "avatar_source": {
    "uri": "ar://placeholder-anonymous-42-minimal",
    "provenance": "ai_generated",
    "provenance_attestation": "Avatar generated by Eros sample pipeline; no real person depicted."
  },
  "behavior": {
    "tip_personality": "default"
  },
  "compliance": {
    "core": {
      "is_nsfw": false,
      "contains_real_person_likeness": false,
      "uses_third_party_ip": false,
      "real_person_disclaimer_acknowledged": false,
      "third_party_ip_disclaimer_acknowledged": false,
      "creator_acknowledgments": ["no_self_harm_encouragement", "no_csam", "no_minor_sexualization"]
    },
    "regional": []
  }
}
